<?xml version="1.0" encoding="UTF-8"?>
<Type_0x03 messageNo="0" messageSequenceNo="0"
	messageSerialNo="0" xmlns="http://www.example.org/msg_0x03" xmlns:u="http://www.example.org/UType"
	xmlns:xsi="http://www.w3.org/2001/XMLSchema-instance"
	xsi:schemaLocation="http://www.example.org/msg_0x03 ../xsd/msg_0x03.xsd ">
	<WebHosts>
		<WebHost>tns:WebHost</WebHost>
		<HitFrquency>0</HitFrquency>
	</WebHosts>
	<WebHosts>
		<WebHost>tns:WebHost</WebHost>
		<HitFrquency>0</HitFrquency>
	</WebHosts>
	<WebHosts>
		<WebHost>WebHost</WebHost>
		<HitFrquency>0</HitFrquency>
	</WebHosts>
</Type_0x03>
